{
  "$schema": "https://json-schema.org/draft/2020-12/schema",
  "$id": "https://baja-insights/contracts/overlay.schema.json",
  "title": "Baja-Insights graphics order (contract v1.1)",
  "description": "Produced by the agents (member 2), drawn by the web UI or any broadcast engine (member 3). v1.1 only adds optional fields; see docs/cambios-contrato-v1.1.md.",
  "type": "object",
  "required": ["overlay_id", "match_id", "source_insight", "period", "show_at", "show_at_s", "duration_s", "slot",
               "mode", "language", "type", "title", "text"],
  "properties": {
    "overlay_id": {"type": "string"},
    "match_id": {"type": "string"},
    "source_insight": {"type": ["string", "null"], "description": "insight_id it came from, null for duel-bar animation frames"},
    "period": {"enum": [1, 2]},
    "show_at": {"type": "string", "pattern": "^[0-9]{2}:[0-5][0-9]$"},
    "show_at_s": {"type": "integer", "minimum": 0, "maximum": 5520},
    "duration_s": {"type": "number", "exclusiveMinimum": 0, "maximum": 60},
    "slot": {"enum": ["top_right", "lower_third", "side_panel", "bottom_bar", "center", "full_screen"]},
    "mode": {"enum": ["fan", "analyst", "all"]},
    "language": {"type": "string", "description": "BCP-47 code such as es or en, or all"},
    "type": {"enum": ["mvp_update", "duel_bar", "standout_milestone", "card_upgrade", "goal_analysis", "team_phase",
                      "match_keys", "top3", "chat_answer"]},
    "title": {"type": ["string", "null"]},
    "text": {"type": ["string", "null"]},
    "evidence": {
      "type": "array", "items": {"type": "integer", "minimum": 1},
      "description": "v1.1. event_id values that back the order, copied from the insight's evidence. Omitted in duel-bar frames."
    },
    "card": {
      "type": "object",
      "required": ["player", "team", "position", "attribute", "from", "to", "delta"],
      "properties": {
        "player": {"type": "string"}, "team": {"type": "string"},
        "position": {"$ref": "#/$defs/position"},
        "attribute": {"enum": ["ritmo", "disparo", "vision", "regate", "defensa", "fisico", "sin_balon"]},
        "from": {"type": "integer"}, "to": {"type": "integer"}, "delta": {"type": "integer"},
        "overall_from": {"type": "integer", "description": "v1.1. Copied from the insight's card_change. The UI never computes the overall."},
        "overall_to": {"type": "integer", "maximum": 99, "description": "v1.1"},
        "reason": {"type": "string", "description": "v1.1. The engine's reason, in Spanish with digits, as in the insight."},
        "reason_code": {"description": "v1.1, optional. Copied from the insight's card_change; the UI writes the text in each language.",
                        "enum": ["line_breaking_pass", "opp_half_recoveries", "shot_speed", "duel_streak", "run_speed", "dribbles", "run_ended_in_shot", "run_opened_goal", "standout_defensive", "standout_creative", "pass_streak", "recovery_to_shot", "big_save"]},
        "reason_params": {"description": "v1.1, optional. Copied from the insight's card_change.", "type": "object"}
      }
    },
    "data": {"type": "object"}
  },
  "allOf": [
    {"if": {"properties": {"type": {"const": "duel_bar"}}},
     "then": {"required": ["data"], "properties": {"data": {"required": ["player_a", "player_b", "bar"],
                                                            "properties": {"bar": {"type": "number", "minimum": -1, "maximum": 1}}}}}},
    {"if": {"properties": {"type": {"const": "mvp_update"}}},
     "then": {"required": ["data"], "properties": {"data": {"required": ["rank", "mvp_score"],
              "properties": {"ranking": {"$ref": "#/$defs/ranking"}}}}}},
    {"if": {"properties": {"type": {"const": "top3"}}},
     "then": {"required": ["data"], "properties": {"data": {"required": ["cards"],
              "properties": {"cards": {"type": "array", "items": {"required": ["rank", "player", "mvp_score"]}}}}}}},
    {"if": {"properties": {"type": {"const": "goal_analysis"}}},
     "then": {"required": ["data"], "properties": {"data": {"required": ["chain", "credit"], "properties": {
              "invisible_assist": {
                "description": "v1.1 accepts the object the agents already emit (same shape as goal_chain.facts.invisible_assist). The plain player name used by the v1 mock is deprecated and will be removed in v2.",
                "anyOf": [{"type": "null"}, {"type": "string"}, {"$ref": "#/$defs/invisible_assist"}]},
              "chain_detail": {
                "description": "v1.1. Same items as goal_chain.facts.chain, in time order, credits summing to 1.",
                "type": "array", "minItems": 1, "items": {"$ref": "#/$defs/chain_link"}}}}}}},
    {"if": {"properties": {"type": {"const": "card_upgrade"}}}, "then": {"required": ["card"]}},
    {"if": {"properties": {"type": {"const": "chat_answer"}}},
     "then": {"required": ["data"], "properties": {"data": {"$ref": "#/$defs/chat_answer_data"}}}}
  ],
  "$defs": {
    "point_or_null": {
      "description": "Pitch coordinates [x, y] in metres, origin at the bottom-left corner, as in event.schema.json.",
      "oneOf": [
        {"type": "null"},
        {"type": "array", "prefixItems": [{"type": "number", "minimum": 0, "maximum": 105}, {"type": "number", "minimum": 0, "maximum": 68}],
         "minItems": 2, "maxItems": 2}
      ]
    },
    "position": {"enum": ["POR", "LD", "LI", "DFC", "MCD", "MC", "ED", "EI", "DC"]},
    "ranking": {
      "description": "v1.1. MVP ranking snapshot at the moment of the order, same items as get_mvp_ranking. Top 5 recommended.",
      "type": "array", "minItems": 1, "maxItems": 22,
      "items": {
        "type": "object", "required": ["rank", "player", "team", "position", "mvp_score"],
        "properties": {
          "rank": {"type": "integer", "minimum": 1}, "player": {"type": "string"}, "team": {"type": "string"},
          "position": {"$ref": "#/$defs/position"}, "mvp_score": {"type": "number"}
        }
      }
    },
    "chain_link": {
      "type": "object", "required": ["event_id", "player", "action", "credit", "t_s"],
      "properties": {
        "event_id": {"type": "integer", "minimum": 1}, "player": {"type": "string"},
        "action": {"type": "string", "description": "Label in Spanish, kept for v1 consumers. Build other languages from type, lines_broken and cross."},
        "credit": {"type": "number", "minimum": 0, "maximum": 1}, "t_s": {"type": "integer", "minimum": 0, "maximum": 5400},
        "type": {"description": "v1.1, optional. The event type of the link, as in event.schema.json.",
                 "enum": ["pass", "shot", "tackle", "recovery", "duel", "pressure", "foul", "off_ball_run"]},
        "lines_broken": {"description": "v1.1, optional. Copied from the event.", "type": "integer", "minimum": 0, "maximum": 4},
        "cross": {"description": "v1.1, optional. Only on passes that are crosses.", "type": "boolean"},
        "start": {"description": "Optional, added to v1.1. Where the event happened, copied from the event, to draw the play.", "$ref": "#/$defs/point_or_null"},
        "end": {"description": "Optional, added to v1.1. Where the pass, shot or run ended, copied from the event. Null on recoveries.", "$ref": "#/$defs/point_or_null"},
        "dragged_defender": {"description": "Optional, added to v1.1. Only on off_ball_run links: the defender the run dragged.", "type": "string"},
        "dragged_defender_start": {"description": "Optional, added to v1.1. Only on scripted off_ball_run links: where the dragged defender was.", "$ref": "#/$defs/point_or_null"},
        "dragged_defender_end": {"description": "Optional, added to v1.1. Only on scripted off_ball_run links: where the run left him.", "$ref": "#/$defs/point_or_null"}
      }
    },
    "invisible_assist": {
      "type": "object", "required": ["player", "dragged_defender", "space_opened_m", "touched_ball"],
      "properties": {
        "player": {"type": "string"}, "dragged_defender": {"type": ["string", "null"]},
        "space_opened_m": {"type": ["number", "null"], "minimum": 0}, "touched_ball": {"type": "boolean"}
      }
    },
    "chat_answer_data": {
      "description": "v1.1. Same fields as the chat response in chat.schema.json, for when the producer puts an answer on screen.",
      "type": "object", "required": ["question", "status", "tools"],
      "properties": {
        "question": {"type": "string", "minLength": 1},
        "status": {"enum": ["answered", "not_tracked", "not_found", "no_prediction"]},
        "tools": {"type": "array", "items": {"enum": ["get_match_state", "get_mvp_ranking", "get_player_summary",
                                                      "get_duel", "get_team_phase", "get_goal_chain"]}},
        "evidence": {"type": "array", "items": {"type": "integer", "minimum": 1}}
      }
    }
  }
}
