[
  {
    "overlay_id": "o049",
    "match_id": "m001",
    "source_insight": null,
    "period": 1,
    "show_at": "05:00",
    "show_at_s": 300,
    "duration_s": 4,
    "slot": "bottom_bar",
    "mode": "all",
    "language": "all",
    "type": "duel_bar",
    "title": null,
    "text": null,
    "data": {
      "player_a": "D. Mena",
      "player_b": "D. Verdugo",
      "bar": 0.0
    }
  },
  {
    "overlay_id": "o001",
    "match_id": "m001",
    "source_insight": "i01",
    "period": 1,
    "show_at": "12:27",
    "show_at_s": 747,
    "duration_s": 8,
    "slot": "bottom_bar",
    "mode": "fan",
    "language": "es",
    "type": "duel_bar",
    "title": "Mena vs Verdugo",
    "text": "Verdugo le gana la primera a Mena y casi llega el gol.",
    "data": {
      "player_a": "D. Mena",
      "player_b": "D. Verdugo",
      "bar": -0.5
    }
  },
  {
    "overlay_id": "o002",
    "match_id": "m001",
    "source_insight": "i01",
    "period": 1,
    "show_at": "12:27",
    "show_at_s": 747,
    "duration_s": 8,
    "slot": "bottom_bar",
    "mode": "analyst",
    "language": "es",
    "type": "duel_bar",
    "title": "Duelo de banda",
    "text": "Verdugo +0.60 sobre su rol, Mena -0.40. 1 duelo ganado y 1 ocasión creada por la izquierda de Cardón.",
    "data": {
      "player_a": "D. Mena",
      "player_b": "D. Verdugo",
      "bar": -0.5
    }
  },
  {
    "overlay_id": "o003",
    "match_id": "m001",
    "source_insight": "i01",
    "period": 1,
    "show_at": "12:27",
    "show_at_s": 747,
    "duration_s": 8,
    "slot": "bottom_bar",
    "mode": "fan",
    "language": "en",
    "type": "duel_bar",
    "title": "Mena vs Verdugo",
    "text": "Verdugo wins round one and nearly sets up a goal.",
    "data": {
      "player_a": "D. Mena",
      "player_b": "D. Verdugo",
      "bar": -0.5
    }
  },
  {
    "overlay_id": "o004",
    "match_id": "m001",
    "source_insight": "i01",
    "period": 1,
    "show_at": "12:27",
    "show_at_s": 747,
    "duration_s": 8,
    "slot": "bottom_bar",
    "mode": "analyst",
    "language": "en",
    "type": "duel_bar",
    "title": "Flank duel",
    "text": "Verdugo +0.60 above role, Mena -0.40. 1 duel won and 1 chance created down Cardón's left.",
    "data": {
      "player_a": "D. Mena",
      "player_b": "D. Verdugo",
      "bar": -0.5
    }
  },
  {
    "overlay_id": "o005",
    "match_id": "m001",
    "source_insight": "i02",
    "period": 1,
    "show_at": "17:42",
    "show_at_s": 1062,
    "duration_s": 10,
    "slot": "center",
    "mode": "fan",
    "language": "es",
    "type": "goal_analysis",
    "title": "Gol de Leyva",
    "text": "Todo empezó con Rosas, que encontró a Montaño saltándose a medio equipo.",
    "data": {
      "chain": [
        "V. Meza",
        "K. Rosas",
        "L. Montaño",
        "S. Leyva"
      ],
      "credit": [
        0.2,
        0.3,
        0.25,
        0.25
      ]
    }
  },
  {
    "overlay_id": "o006",
    "match_id": "m001",
    "source_insight": "i02",
    "period": 1,
    "show_at": "17:42",
    "show_at_s": 1062,
    "duration_s": 10,
    "slot": "center",
    "mode": "analyst",
    "language": "es",
    "type": "goal_analysis",
    "title": "Cadena del gol 0-1",
    "text": "Meza recupera, Rosas rompe 2 líneas bajo presión, centro de Montaño y remate de Leyva. xG 0.38 en 18 s.",
    "data": {
      "chain": [
        "V. Meza",
        "K. Rosas",
        "L. Montaño",
        "S. Leyva"
      ],
      "credit": [
        0.2,
        0.3,
        0.25,
        0.25
      ]
    }
  },
  {
    "overlay_id": "o007",
    "match_id": "m001",
    "source_insight": "i02",
    "period": 1,
    "show_at": "17:42",
    "show_at_s": 1062,
    "duration_s": 10,
    "slot": "center",
    "mode": "fan",
    "language": "en",
    "type": "goal_analysis",
    "title": "Leyva scores",
    "text": "It started with Rosas, who found Montaño by skipping half the team.",
    "data": {
      "chain": [
        "V. Meza",
        "K. Rosas",
        "L. Montaño",
        "S. Leyva"
      ],
      "credit": [
        0.2,
        0.3,
        0.25,
        0.25
      ]
    }
  },
  {
    "overlay_id": "o008",
    "match_id": "m001",
    "source_insight": "i02",
    "period": 1,
    "show_at": "17:42",
    "show_at_s": 1062,
    "duration_s": 10,
    "slot": "center",
    "mode": "analyst",
    "language": "en",
    "type": "goal_analysis",
    "title": "Goal chain 0-1",
    "text": "Meza recovers, Rosas breaks 2 lines under pressure, Montaño crosses, Leyva finishes. xG 0.38 in 18 s.",
    "data": {
      "chain": [
        "V. Meza",
        "K. Rosas",
        "L. Montaño",
        "S. Leyva"
      ],
      "credit": [
        0.2,
        0.3,
        0.25,
        0.25
      ]
    }
  },
  {
    "overlay_id": "o050",
    "match_id": "m001",
    "source_insight": null,
    "period": 1,
    "show_at": "20:00",
    "show_at_s": 1200,
    "duration_s": 4,
    "slot": "bottom_bar",
    "mode": "all",
    "language": "all",
    "type": "duel_bar",
    "title": null,
    "text": null,
    "data": {
      "player_a": "D. Mena",
      "player_b": "D. Verdugo",
      "bar": -0.25
    }
  },
  {
    "overlay_id": "o009",
    "match_id": "m001",
    "source_insight": "i03",
    "period": 1,
    "show_at": "22:02",
    "show_at_s": 1322,
    "duration_s": 8,
    "slot": "side_panel",
    "mode": "fan",
    "language": "es",
    "type": "team_phase",
    "title": "Cardón manda",
    "text": "Real Cardón tiene la pelota y no la suelta.",
    "data": {
      "label": "control",
      "possession_pct": 64
    }
  },
  {
    "overlay_id": "o010",
    "match_id": "m001",
    "source_insight": "i03",
    "period": 1,
    "show_at": "22:02",
    "show_at_s": 1322,
    "duration_s": 8,
    "slot": "side_panel",
    "mode": "analyst",
    "language": "es",
    "type": "team_phase",
    "title": "Fase de control",
    "text": "Cardón 64% de posesión entre el 12 y el 22. Pases completados 88% contra 71%.",
    "data": {
      "label": "control",
      "possession_pct": 64
    }
  },
  {
    "overlay_id": "o011",
    "match_id": "m001",
    "source_insight": "i03",
    "period": 1,
    "show_at": "22:02",
    "show_at_s": 1322,
    "duration_s": 8,
    "slot": "side_panel",
    "mode": "fan",
    "language": "en",
    "type": "team_phase",
    "title": "Cardón in charge",
    "text": "Real Cardón have the ball and aren't giving it back.",
    "data": {
      "label": "control",
      "possession_pct": 64
    }
  },
  {
    "overlay_id": "o012",
    "match_id": "m001",
    "source_insight": "i03",
    "period": 1,
    "show_at": "22:02",
    "show_at_s": 1322,
    "duration_s": 8,
    "slot": "side_panel",
    "mode": "analyst",
    "language": "en",
    "type": "team_phase",
    "title": "Control phase",
    "text": "Cardón 64% possession from 12 to 22. Pass accuracy 88% vs 71%.",
    "data": {
      "label": "control",
      "possession_pct": 64
    }
  },
  {
    "overlay_id": "o051",
    "match_id": "m001",
    "source_insight": null,
    "period": 1,
    "show_at": "30:00",
    "show_at_s": 1800,
    "duration_s": 4,
    "slot": "bottom_bar",
    "mode": "all",
    "language": "all",
    "type": "duel_bar",
    "title": null,
    "text": null,
    "data": {
      "player_a": "D. Mena",
      "player_b": "D. Verdugo",
      "bar": -0.05
    }
  },
  {
    "overlay_id": "o013",
    "match_id": "m001",
    "source_insight": "i05",
    "period": 1,
    "show_at": "33:42",
    "show_at_s": 2022,
    "duration_s": 7,
    "slot": "top_right",
    "mode": "fan",
    "language": "es",
    "type": "mvp_update",
    "title": "Torres, número 1",
    "text": "Torres sube al primer lugar tras su tercera recuperación.",
    "card": {
      "player": "J. Torres",
      "team": "Bahía FC",
      "position": "ED",
      "attribute": "defensa",
      "from": 58,
      "to": 60,
      "delta": 2
    },
    "data": {
      "rank": 1,
      "previous_rank": 3,
      "mvp_score": 6.2
    }
  },
  {
    "overlay_id": "o014",
    "match_id": "m001",
    "source_insight": "i05",
    "period": 1,
    "show_at": "33:42",
    "show_at_s": 2022,
    "duration_s": 7,
    "slot": "top_right",
    "mode": "analyst",
    "language": "es",
    "type": "mvp_update",
    "title": "MVP en vivo · 1.º J. Torres",
    "text": "3 recuperaciones en campo rival en 10 min. Lo esperado para un extremo a esta altura es 0.9. Puntaje 6.2.",
    "card": {
      "player": "J. Torres",
      "team": "Bahía FC",
      "position": "ED",
      "attribute": "defensa",
      "from": 58,
      "to": 60,
      "delta": 2
    },
    "data": {
      "rank": 1,
      "previous_rank": 3,
      "mvp_score": 6.2
    }
  },
  {
    "overlay_id": "o015",
    "match_id": "m001",
    "source_insight": "i05",
    "period": 1,
    "show_at": "33:42",
    "show_at_s": 2022,
    "duration_s": 7,
    "slot": "top_right",
    "mode": "fan",
    "language": "en",
    "type": "mvp_update",
    "title": "Torres takes the top spot",
    "text": "Torres climbs to first after his third ball recovery.",
    "card": {
      "player": "J. Torres",
      "team": "Bahía FC",
      "position": "ED",
      "attribute": "defensa",
      "from": 58,
      "to": 60,
      "delta": 2
    },
    "data": {
      "rank": 1,
      "previous_rank": 3,
      "mvp_score": 6.2
    }
  },
  {
    "overlay_id": "o016",
    "match_id": "m001",
    "source_insight": "i05",
    "period": 1,
    "show_at": "33:42",
    "show_at_s": 2022,
    "duration_s": 7,
    "slot": "top_right",
    "mode": "analyst",
    "language": "en",
    "type": "mvp_update",
    "title": "Live MVP · 1st J. Torres",
    "text": "3 recoveries in the opponent's half in 10 min vs 0.9 expected for a winger. Score 6.2.",
    "card": {
      "player": "J. Torres",
      "team": "Bahía FC",
      "position": "ED",
      "attribute": "defensa",
      "from": 58,
      "to": 60,
      "delta": 2
    },
    "data": {
      "rank": 1,
      "previous_rank": 3,
      "mvp_score": 6.2